[ {
  "id" : 29,
  "name" : "NNgxttX7lZJ3",
  "age" : 45,
  "active" : true,
  "rating" : 4.5,
  "totalBooks" : 3,
  "genres" : [ "Fiction", "Mystery" ],
  "scores" : [ 90, 85, 78 ],
  "wealth" : 100000.5,
  "followers" : 1500
}, {
  "id" : 30,
  "name" : "GXzAQtpVs3",
  "age" : 35,
  "active" : true,
  "rating" : null,
  "totalBooks" : null,
  "genres" : null,
  "scores" : null,
  "wealth" : null,
  "followers" : null
}, {
  "id" : 31,
  "name" : "yc3I55TR",
  "age" : 40,
  "active" : true,
  "rating" : null,
  "totalBooks" : null,
  "genres" : null,
  "scores" : null,
  "wealth" : null,
  "followers" : null
} ]